{"assetIds":[],"bundleId":"fire-sparkles-cards","fullEntry":"compositions/full.html","runtime":{"gsapSha256":"c174bfce53a729418d57a8ad8625e7247c793a22fef8e2851e3cfa3de9cd8280","hyperframesVersion":"0.8.31"},"schemaVersion":1,"seed":424242,"supportedCanvases":[{"height":1080,"width":1920}],"supportedFps":[{"denominator":"1","numerator":"30"},{"denominator":"1001","numerator":"30000"}],"unitEntries":{"unit-left":"compositions/unit-left.html","unit-right":"compositions/unit-right.html"},"variables":[{"elementIds":["left-blue-card"],"id":"leftTitle","maxLength":120,"required":true,"type":"string"},{"elementIds":["right-copy"],"id":"rightTitle","maxLength":120,"required":true,"type":"string"},{"default":"#0B5FFF","elementIds":["left-blue-card"],"id":"leftColor","required":true,"type":"color"},{"default":424242,"elementIds":["seeded-fire","seeded-sparkles"],"id":"seed","required":true,"type":"number"},{"default":1,"elementIds":["seeded-fire"],"id":"fireIntensity","required":true,"type":"number"},{"default":22,"elementIds":["seeded-sparkles"],"id":"sparkleCount","required":true,"type":"number"}]}
